<?xml version="1.0" encoding="UTF-8"?>
<carriers xmlns="http://www.matsim.org/files/dtd" xmlns:xsi="http://www.w3.org/2001/XMLSchema-instance" xsi:schemaLocation="http://www.matsim.org/files/dtd http://www.matsim.org/files/dtd/carriersDefinitions_v2.1.xsd">
	<carrier id="ccCarrier1withServices">
		<capabilities fleetSize="INFINITE">
			<vehicles>
				<vehicle id="cargo_bike" depotLinkId="1" typeId="cargo_bike" earliestStart="11:00:00" latestEnd="15:00:00"/>
				<vehicle id="heavy_truck" depotLinkId="1" typeId="heavy_truck" earliestStart="12:00:00" latestEnd="23:00:00"/>
			</vehicles>
		</capabilities>
		<services>
			<service id="small_service" to="i(1,9)R" capacityDemand="3" earliestStart="04:00:00" latestEnd="18:00:00" serviceDuration="00:05:00"/>
			<service id="medium_service" to="i(1,9)R" capacityDemand="7" earliestStart="04:00:00" latestEnd="18:00:00" serviceDuration="00:05:00"/>
			<service id="large_service" to="i(1,9)R" capacityDemand="16" earliestStart="04:00:00" latestEnd="18:00:00" serviceDuration="00:05:00"/>
			<service id="extra_large_service" to="i(1,9)R" capacityDemand="29" earliestStart="04:00:00" latestEnd="18:00:00" serviceDuration="00:05:00"/>
		</services>
	</carrier>
	<carrier id="ccCarrier2withServices">
		<capabilities fleetSize="INFINITE">
			<vehicles>
				<vehicle id="medium_van" depotLinkId="1" typeId="medium_van" earliestStart="11:00:00" latestEnd="15:00:00"/>
				<vehicle id="heavy_truck" depotLinkId="1" typeId="heavy_truck" earliestStart="12:00:00" latestEnd="23:00:00"/>
			</vehicles>
		</capabilities>
		<services>
			<service id="small_service" to="i(1,9)R" capacityDemand="10" earliestStart="04:00:00" latestEnd="18:00:00" serviceDuration="00:05:00"/>
			<service id="medium_service" to="i(1,9)R" capacityDemand="8" earliestStart="04:00:00" latestEnd="18:00:00" serviceDuration="00:05:00"/>
			<service id="large_service" to="i(1,9)R" capacityDemand="16" earliestStart="04:00:00" latestEnd="18:00:00" serviceDuration="00:05:00"/>
			<service id="extra_large_service" to="i(1,9)R" capacityDemand="30" earliestStart="04:00:00" latestEnd="18:00:00" serviceDuration="00:05:00"/>
		</services>
	</carrier>
</carriers>
